{
  "eventId": "d4e5f607-8901-4234-a567-89abcdef0123",
  "eventType": "factory.control-outcome",
  "schemaVersion": 1,
  "equipmentId": "eq-001",
  "commandId": "11112222-3333-4444-8555-666677778888",
  "decisionId": null,
  "occurredAtUtc": "2026-09-15T04:02:20.500Z",
  "appliedAtUtc": "2026-09-15T04:02:20.610Z",
  "ingestTimeUtc": "2026-09-15T04:02:20.615Z",
  "producer": "control-service@ctl-1",
  "status": "APPLIED",
  "reasonCode": "SUPERVISOR_SILENT",
  "authenticatedSource": "spiffe://mair/control-service",
  "controlEpoch": 42,
  "requestedTargetPct": null,
  "appliedTargetPct": 60.0,
  "wasClamped": false,
  "resultingMode": "SAFE_FALLBACK",
  "fromMode": "AI_ASSISTED",
  "modeTransitionId": "M4",
  "operatorId": null,
  "autonomous": true,
  "correlationId": "7a6b5c4d-3e2f-4109-8877-665544332210",
  "causationId": null
}
